[
  {
    "sku": "BUNDLE-146E0C58",
    "quantity": 115,
    "sources": [
      {
        "source_code": "warehouse_west",
        "quantity": 65
      },
      {
        "source_code": "warehouse_atlanta",
        "quantity": 50
      }
    ],
    "is_in_stock": true,
    "manage_stock": true,
    "use_config_manage_stock": true,
    "min_qty": 0,
    "max_sale_qty": 10000,
    "backorders": "no_backorders",
    "qty_increments": 1
  },
  {
    "sku": "BUNDLE-30A77EB0",
    "quantity": 174,
    "sources": [
      {
        "source_code": "warehouse_west",
        "quantity": 100
      },
      {
        "source_code": "warehouse_east",
        "quantity": 24
      },
      {
        "source_code": "warehouse_atlanta",
        "quantity": 50
      }
    ],
    "is_in_stock": true,
    "manage_stock": true,
    "use_config_manage_stock": true,
    "min_qty": 0,
    "max_sale_qty": 10000,
    "backorders": "no_backorders",
    "qty_increments": 1
  },
  {
    "sku": "BUNDLE-3A939652",
    "quantity": 88,
    "sources": [
      {
        "source_code": "warehouse_west",
        "quantity": 38
      },
      {
        "source_code": "warehouse_atlanta",
        "quantity": 50
      }
    ],
    "is_in_stock": true,
    "manage_stock": true,
    "use_config_manage_stock": true,
    "min_qty": 0,
    "max_sale_qty": 10000,
    "backorders": "no_backorders",
    "qty_increments": 1
  },
  {
    "sku": "BUNDLE-69ED02AC",
    "quantity": 132,
    "sources": [
      {
        "source_code": "warehouse_west",
        "quantity": 82
      },
      {
        "source_code": "warehouse_atlanta",
        "quantity": 50
      }
    ],
    "is_in_stock": true,
    "manage_stock": true,
    "use_config_manage_stock": true,
    "min_qty": 0,
    "max_sale_qty": 10000,
    "backorders": "no_backorders",
    "qty_increments": 1
  },
  {
    "sku": "BUNDLE-6EAD6945",
    "quantity": 196,
    "sources": [
      {
        "source_code": "warehouse_west",
        "quantity": 100
      },
      {
        "source_code": "warehouse_east",
        "quantity": 46
      },
      {
        "source_code": "warehouse_atlanta",
        "quantity": 50
      }
    ],
    "is_in_stock": true,
    "manage_stock": true,
    "use_config_manage_stock": true,
    "min_qty": 0,
    "max_sale_qty": 10000,
    "backorders": "no_backorders",
    "qty_increments": 1
  },
  {
    "sku": "BUNDLE-ACAAA502",
    "quantity": 191,
    "sources": [
      {
        "source_code": "warehouse_west",
        "quantity": 100
      },
      {
        "source_code": "warehouse_east",
        "quantity": 41
      },
      {
        "source_code": "warehouse_atlanta",
        "quantity": 50
      }
    ],
    "is_in_stock": true,
    "manage_stock": true,
    "use_config_manage_stock": true,
    "min_qty": 0,
    "max_sale_qty": 10000,
    "backorders": "no_backorders",
    "qty_increments": 1
  },
  {
    "sku": "BUNDLE-B15554D6",
    "quantity": 157,
    "sources": [
      {
        "source_code": "warehouse_west",
        "quantity": 100
      },
      {
        "source_code": "warehouse_east",
        "quantity": 7
      },
      {
        "source_code": "warehouse_atlanta",
        "quantity": 50
      }
    ],
    "is_in_stock": true,
    "manage_stock": true,
    "use_config_manage_stock": true,
    "min_qty": 0,
    "max_sale_qty": 10000,
    "backorders": "no_backorders",
    "qty_increments": 1
  },
  {
    "sku": "BUNDLE-BEC3CB65",
    "quantity": 110,
    "sources": [
      {
        "source_code": "warehouse_west",
        "quantity": 60
      },
      {
        "source_code": "warehouse_atlanta",
        "quantity": 50
      }
    ],
    "is_in_stock": true,
    "manage_stock": true,
    "use_config_manage_stock": true,
    "min_qty": 0,
    "max_sale_qty": 10000,
    "backorders": "no_backorders",
    "qty_increments": 1
  },
  {
    "sku": "BUNDLE-CF3C554A",
    "quantity": 190,
    "sources": [
      {
        "source_code": "warehouse_west",
        "quantity": 100
      },
      {
        "source_code": "warehouse_east",
        "quantity": 40
      },
      {
        "source_code": "warehouse_atlanta",
        "quantity": 50
      }
    ],
    "is_in_stock": true,
    "manage_stock": true,
    "use_config_manage_stock": true,
    "min_qty": 0,
    "max_sale_qty": 10000,
    "backorders": "no_backorders",
    "qty_increments": 1
  },
  {
    "sku": "BUNDLE-E7EC0D01",
    "quantity": 139,
    "sources": [
      {
        "source_code": "warehouse_west",
        "quantity": 89
      },
      {
        "source_code": "warehouse_atlanta",
        "quantity": 50
      }
    ],
    "is_in_stock": true,
    "manage_stock": true,
    "use_config_manage_stock": true,
    "min_qty": 0,
    "max_sale_qty": 10000,
    "backorders": "no_backorders",
    "qty_increments": 1
  },
  {
    "sku": "BUNDLE-EA668F19",
    "quantity": 189,
    "sources": [
      {
        "source_code": "warehouse_west",
        "quantity": 100
      },
      {
        "source_code": "warehouse_east",
        "quantity": 39
      },
      {
        "source_code": "warehouse_atlanta",
        "quantity": 50
      }
    ],
    "is_in_stock": true,
    "manage_stock": true,
    "use_config_manage_stock": true,
    "min_qty": 0,
    "max_sale_qty": 10000,
    "backorders": "no_backorders",
    "qty_increments": 1
  },
  {
    "sku": "BUNDLE-EE01B258",
    "quantity": 104,
    "sources": [
      {
        "source_code": "warehouse_west",
        "quantity": 54
      },
      {
        "source_code": "warehouse_atlanta",
        "quantity": 50
      }
    ],
    "is_in_stock": true,
    "manage_stock": true,
    "use_config_manage_stock": true,
    "min_qty": 0,
    "max_sale_qty": 10000,
    "backorders": "no_backorders",
    "qty_increments": 1
  },
  {
    "sku": "BUNDLE-F57CEA64",
    "quantity": 92,
    "sources": [
      {
        "source_code": "warehouse_west",
        "quantity": 42
      },
      {
        "source_code": "warehouse_atlanta",
        "quantity": 50
      }
    ],
    "is_in_stock": true,
    "manage_stock": true,
    "use_config_manage_stock": true,
    "min_qty": 0,
    "max_sale_qty": 10000,
    "backorders": "no_backorders",
    "qty_increments": 1
  },
  {
    "sku": "BUNDLE-FCDED404",
    "quantity": 141,
    "sources": [
      {
        "source_code": "warehouse_west",
        "quantity": 91
      },
      {
        "source_code": "warehouse_atlanta",
        "quantity": 50
      }
    ],
    "is_in_stock": true,
    "manage_stock": true,
    "use_config_manage_stock": true,
    "min_qty": 0,
    "max_sale_qty": 10000,
    "backorders": "no_backorders",
    "qty_increments": 1
  },
  {
    "sku": "BUNDLE-FD8BAF02",
    "quantity": 146,
    "sources": [
      {
        "source_code": "warehouse_west",
        "quantity": 96
      },
      {
        "source_code": "warehouse_atlanta",
        "quantity": 50
      }
    ],
    "is_in_stock": true,
    "manage_stock": true,
    "use_config_manage_stock": true,
    "min_qty": 0,
    "max_sale_qty": 10000,
    "backorders": "no_backorders",
    "qty_increments": 1
  },
  {
    "sku": "DOOR-070629C1",
    "quantity": 148,
    "sources": [
      {
        "source_code": "warehouse_east",
        "quantity": 98
      },
      {
        "source_code": "warehouse_atlanta",
        "quantity": 50
      }
    ],
    "is_in_stock": true,
    "manage_stock": true,
    "use_config_manage_stock": true,
    "min_qty": 0,
    "max_sale_qty": 10000,
    "backorders": "no_backorders",
    "qty_increments": 1
  },
  {
    "sku": "DOOR-34C72FD2",
    "quantity": 155,
    "sources": [
      {
        "source_code": "warehouse_east",
        "quantity": 105
      },
      {
        "source_code": "warehouse_atlanta",
        "quantity": 50
      }
    ],
    "is_in_stock": true,
    "manage_stock": true,
    "use_config_manage_stock": true,
    "min_qty": 0,
    "max_sale_qty": 10000,
    "backorders": "no_backorders",
    "qty_increments": 1
  },
  {
    "sku": "DOOR-75F9C73D",
    "quantity": 133,
    "sources": [
      {
        "source_code": "warehouse_east",
        "quantity": 83
      },
      {
        "source_code": "warehouse_atlanta",
        "quantity": 50
      }
    ],
    "is_in_stock": true,
    "manage_stock": true,
    "use_config_manage_stock": true,
    "min_qty": 0,
    "max_sale_qty": 10000,
    "backorders": "no_backorders",
    "qty_increments": 1
  },
  {
    "sku": "DOOR-81B579D4",
    "quantity": 208,
    "sources": [
      {
        "source_code": "warehouse_east",
        "quantity": 154
      },
      {
        "source_code": "warehouse_atlanta",
        "quantity": 54
      }
    ],
    "is_in_stock": true,
    "manage_stock": true,
    "use_config_manage_stock": true,
    "min_qty": 0,
    "max_sale_qty": 10000,
    "backorders": "no_backorders",
    "qty_increments": 1
  },
  {
    "sku": "DOOR-89357B1F",
    "quantity": 280,
    "sources": [
      {
        "source_code": "warehouse_east",
        "quantity": 190
      },
      {
        "source_code": "warehouse_atlanta",
        "quantity": 90
      }
    ],
    "is_in_stock": true,
    "manage_stock": true,
    "use_config_manage_stock": true,
    "min_qty": 0,
    "max_sale_qty": 10000,
    "backorders": "no_backorders",
    "qty_increments": 1
  },
  {
    "sku": "DOOR-E93CC71C",
    "quantity": 128,
    "sources": [
      {
        "source_code": "warehouse_east",
        "quantity": 78
      },
      {
        "source_code": "warehouse_atlanta",
        "quantity": 50
      }
    ],
    "is_in_stock": true,
    "manage_stock": true,
    "use_config_manage_stock": true,
    "min_qty": 0,
    "max_sale_qty": 10000,
    "backorders": "no_backorders",
    "qty_increments": 1
  },
  {
    "sku": "DRYWALL-038C3C6C",
    "quantity": 546,
    "sources": [
      {
        "source_code": "warehouse_west",
        "quantity": 229
      },
      {
        "source_code": "warehouse_east",
        "quantity": 125
      },
      {